{
  "$schema": "./pricing.schema.json",
  "version": 1,
  "as_of": "2026-07-31",
  "currency": "CNY",
  "note": "金额按事件发生时保存的公开 API 原价快照计算，不含套餐、赠金、限时折扣或账户级优惠；未匹配到公开单价的模型不会计入金额。",
  "models": [
    {"key":"mimo:mimo-v2.5-pro-ultraspeed","provider":"mimo","provider_label":"MiMo","model":"mimo-v2.5-pro-ultraspeed","kind":"chat","input_cache_hit_per_million":"0.075","input_cache_miss_per_million":"9","output_per_million":"18","source_url":"https://mimo.mi.com/models/en-US/mimo-v2.5-pro-ultraspeed"},
    {"key":"kimi:kimi-k2.7-code","provider":"kimi","provider_label":"Kimi","model":"kimi-k2.7-code","kind":"chat","input_cache_hit_per_million":"1.30","input_cache_miss_per_million":"6.50","output_per_million":"27","source_url":"https://platform.kimi.com/docs/pricing/chat-k27-code"},
    {"key":"kimi:kimi-k2.7-code-highspeed","provider":"kimi","provider_label":"Kimi","model":"kimi-k2.7-code-highspeed","kind":"chat","input_cache_hit_per_million":"2.60","input_cache_miss_per_million":"13.00","output_per_million":"54.00","source_url":"https://platform.kimi.com/docs/pricing/chat-k27-code"},
    {"key":"deepseek:deepseek-v4-flash","provider":"deepseek","provider_label":"DeepSeek","model":"deepseek-v4-flash","kind":"chat","input_cache_hit_per_million":"0.02","input_cache_miss_per_million":"1","output_per_million":"2","source_url":"https://api-docs.deepseek.com/zh-cn/quick_start/pricing/"},
    {"key":"deepseek:deepseek-v4-pro","provider":"deepseek","provider_label":"DeepSeek","model":"deepseek-v4-pro","kind":"chat","input_cache_hit_per_million":"0.025","input_cache_miss_per_million":"3","output_per_million":"6","source_url":"https://api-docs.deepseek.com/zh-cn/quick_start/pricing/"},
    {"key":"zhipu:glm-5.1:input-lt-32k","provider":"zhipu","provider_label":"智谱","model":"glm-5.1","kind":"chat","input_cache_hit_per_million":"1.3","input_cache_miss_per_million":"6","output_per_million":"24","source_url":"https://bigmodel.cn/pricing","input_token_max":32000,"input_range_label":"输入 < 32K Token"},
    {"key":"zhipu:glm-5.1:input-gte-32k","provider":"zhipu","provider_label":"智谱","model":"glm-5.1","kind":"chat","input_cache_hit_per_million":"2","input_cache_miss_per_million":"8","output_per_million":"28","source_url":"https://bigmodel.cn/pricing","input_token_min":32000,"input_range_label":"输入 ≥ 32K Token"},
    {"key":"zhipu:glm-5.2","provider":"zhipu","provider_label":"智谱","model":"glm-5.2","kind":"chat","input_cache_hit_per_million":"2","input_cache_miss_per_million":"8","output_per_million":"28","source_url":"https://bigmodel.cn/pricing"},
    {"key":"alibaba:text-embedding-v4","provider":"alibaba","provider_label":"阿里云百炼","model":"text-embedding-v4","kind":"embedding","input_cache_hit_per_million":"0.5","input_cache_miss_per_million":"0.5","output_per_million":"0","source_url":"https://help.aliyun.com/zh/model-studio/text-embedding-v4"},
    {"key":"alibaba:qwen3.7-text-embedding","provider":"alibaba","provider_label":"阿里云百炼","model":"qwen3.7-text-embedding","kind":"embedding","input_cache_hit_per_million":"0.5","input_cache_miss_per_million":"0.5","output_per_million":"0","source_url":"https://help.aliyun.com/zh/model-studio/qwen3-7-text-embedding"},
    {"key":"zhipu:embedding-3","provider":"zhipu","provider_label":"智谱","model":"embedding-3","kind":"embedding","input_cache_hit_per_million":"0.5","input_cache_miss_per_million":"0.5","output_per_million":"0","source_url":"https://docs.bigmodel.cn/cn/guide/models/embedding/embedding-3"}
  ]
}
